{"$comment":"Runtime validators additionally enforce stable-ID equality, uniqueness, timestamps, exact prefecture/fuel coverage, hash/source consistency, bbox/cell membership and source approval.","$id":"https://fuel-me-japan.com/data/schemas/station-file.schema.json","$schema":"https://json-schema.org/draft/2020-12/schema","additionalProperties":false,"properties":{"prefectureCode":{"enum":["JP-01","JP-02","JP-03","JP-04","JP-05","JP-06","JP-07","JP-08","JP-09","JP-10","JP-11","JP-12","JP-13","JP-14","JP-15","JP-16","JP-17","JP-18","JP-19","JP-20","JP-21","JP-22","JP-23","JP-24","JP-25","JP-26","JP-27","JP-28","JP-29","JP-30","JP-31","JP-32","JP-33","JP-34","JP-35","JP-36","JP-37","JP-38","JP-39","JP-40","JP-41","JP-42","JP-43","JP-44","JP-45","JP-46","JP-47","UNKNOWN"]},"schemaVersion":{"const":1},"stations":{"items":{"additionalProperties":false,"properties":{"address":{"minLength":1,"type":"string"},"city":{"minLength":1,"type":"string"},"fuelDiesel":{"enum":["YES","NO","UNKNOWN"]},"fuelHighOctane":{"enum":["YES","NO","UNKNOWN"]},"fuelRegular":{"enum":["YES","NO","UNKNOWN"]},"id":{"pattern":"^osm:(node|way|relation):[1-9][0-9]*$","type":"string"},"lat":{"maximum":46,"minimum":20,"type":"number"},"lon":{"maximum":155,"minimum":122,"type":"number"},"name":{"minLength":1,"type":"string"},"normalizedBrand":{"minLength":1,"type":"string"},"openingHours":{"minLength":1,"type":"string"},"originalBrand":{"minLength":1,"type":"string"},"osmId":{"minimum":1,"type":"integer"},"osmType":{"enum":["node","way","relation"]},"paymentMastercard":{"enum":["YES","NO","UNKNOWN"]},"paymentVisa":{"enum":["YES","NO","UNKNOWN"]},"positionMethod":{"enum":["OSM_NODE","SURFACE_POINT","LINE_MIDPOINT"]},"prefectureCode":{"enum":["JP-01","JP-02","JP-03","JP-04","JP-05","JP-06","JP-07","JP-08","JP-09","JP-10","JP-11","JP-12","JP-13","JP-14","JP-15","JP-16","JP-17","JP-18","JP-19","JP-20","JP-21","JP-22","JP-23","JP-24","JP-25","JP-26","JP-27","JP-28","JP-29","JP-30","JP-31","JP-32","JP-33","JP-34","JP-35","JP-36","JP-37","JP-38","JP-39","JP-40","JP-41","JP-42","JP-43","JP-44","JP-45","JP-46","JP-47","UNKNOWN"]},"serviceType":{"enum":["SELF","FULL","UNKNOWN"]},"source":{"const":"osm"},"sourceUpdatedAt":{"format":"date-time","type":"string"}},"required":["id","osmType","osmId","lat","lon","serviceType","paymentVisa","paymentMastercard","fuelRegular","fuelHighOctane","fuelDiesel","source","sourceUpdatedAt","prefectureCode","positionMethod"],"type":"object"},"type":"array"},"version":{"minLength":1,"type":"string"}},"required":["schemaVersion","version","prefectureCode","stations"],"title":"Fuel Me Japan M0.1 station-file","type":"object"}
