{"prefectureCode":"JP-05","schemaVersion":1,"stations":[{"address":"秋田県 由利本荘市 矢島町","city":"由利本荘市","fuelDiesel":"YES","fuelHighOctane":"YES","fuelRegular":"YES","id":"osm:node:10620148856","lat":39.2312612,"lon":140.1454077,"name":"由利石油","normalizedBrand":"ENEOS","openingHours":"Mo-Fr 09:00-19:30, Sa-Su 09:00-19:00","originalBrand":"ENEOS","osmId":10620148856,"osmType":"node","paymentMastercard":"UNKNOWN","paymentVisa":"UNKNOWN","positionMethod":"OSM_NODE","prefectureCode":"JP-05","serviceType":"SELF","source":"osm","sourceUpdatedAt":"2026-07-16T09:33:56Z"},{"fuelDiesel":"UNKNOWN","fuelHighOctane":"UNKNOWN","fuelRegular":"UNKNOWN","id":"osm:node:10687529473","lat":39.2249891,"lon":140.5248596,"name":"コスモ","originalBrand":"コスモ","osmId":10687529473,"osmType":"node","paymentMastercard":"UNKNOWN","paymentVisa":"UNKNOWN","positionMethod":"OSM_NODE","prefectureCode":"JP-05","serviceType":"UNKNOWN","source":"osm","sourceUpdatedAt":"2023-02-23T06:18:24Z"},{"address":"秋田県 由利本荘市 矢島町七日町 1","city":"由利本荘市","fuelDiesel":"YES","fuelHighOctane":"YES","fuelRegular":"YES","id":"osm:node:10779376572","lat":39.2314196,"lon":140.1419758,"name":"㈲エコ矢島サービス ニュー矢島SS","normalizedBrand":"ENEOS","originalBrand":"ENEOS","osmId":10779376572,"osmType":"node","paymentMastercard":"UNKNOWN","paymentVisa":"UNKNOWN","positionMethod":"OSM_NODE","prefectureCode":"JP-05","serviceType":"UNKNOWN","source":"osm","sourceUpdatedAt":"2023-04-02T10:01:54Z"},{"fuelDiesel":"UNKNOWN","fuelHighOctane":"UNKNOWN","fuelRegular":"UNKNOWN","id":"osm:node:10951647148","lat":39.2936943,"lon":140.4312898,"name":"JA-SS","originalBrand":"JA","osmId":10951647148,"osmType":"node","paymentMastercard":"UNKNOWN","paymentVisa":"UNKNOWN","positionMethod":"OSM_NODE","prefectureCode":"JP-05","serviceType":"UNKNOWN","source":"osm","sourceUpdatedAt":"2023-06-04T14:21:40Z"},{"fuelDiesel":"UNKNOWN","fuelHighOctane":"UNKNOWN","fuelRegular":"UNKNOWN","id":"osm:node:11048108829","lat":39.5268343,"lon":140.2328961,"name":"コスモ","originalBrand":"コスモ","osmId":11048108829,"osmType":"node","paymentMastercard":"UNKNOWN","paymentVisa":"UNKNOWN","positionMethod":"OSM_NODE","prefectureCode":"JP-05","serviceType":"UNKNOWN","source":"osm","sourceUpdatedAt":"2023-07-15T14:43:42Z"},{"fuelDiesel":"UNKNOWN","fuelHighOctane":"UNKNOWN","fuelRegular":"UNKNOWN","id":"osm:node:11159042452","lat":39.2791707,"lon":140.6213224,"name":"糯田商店","osmId":11159042452,"osmType":"node","paymentMastercard":"UNKNOWN","paymentVisa":"UNKNOWN","positionMethod":"OSM_NODE","prefectureCode":"JP-05","serviceType":"UNKNOWN","source":"osm","sourceUpdatedAt":"2023-08-31T13:16:07Z"},{"fuelDiesel":"UNKNOWN","fuelHighOctane":"UNKNOWN","fuelRegular":"UNKNOWN","id":"osm:node:11160424765","lat":39.3452715,"lon":140.4208263,"name":"ENEOS","normalizedBrand":"ENEOS","originalBrand":"ENEOS","osmId":11160424765,"osmType":"node","paymentMastercard":"UNKNOWN","paymentVisa":"UNKNOWN","positionMethod":"OSM_NODE","prefectureCode":"JP-05","serviceType":"UNKNOWN","source":"osm","sourceUpdatedAt":"2023-09-01T08:47:32Z"},{"fuelDiesel":"UNKNOWN","fuelHighOctane":"UNKNOWN","fuelRegular":"UNKNOWN","id":"osm:node:11250161699","lat":39.2949201,"lon":140.5898166,"name":"ENEOS","normalizedBrand":"ENEOS","originalBrand":"ENEOS","osmId":11250161699,"osmType":"node","paymentMastercard":"UNKNOWN","paymentVisa":"UNKNOWN","positionMethod":"OSM_NODE","prefectureCode":"JP-05","serviceType":"UNKNOWN","source":"osm","sourceUpdatedAt":"2023-10-09T02:01:27Z"},{"fuelDiesel":"UNKNOWN","fuelHighOctane":"UNKNOWN","fuelRegular":"UNKNOWN","id":"osm:node:11342731975","lat":39.2533081,"lon":140.4789883,"name":"コスモ","originalBrand":"コスモ","osmId":11342731975,"osmType":"node","paymentMastercard":"UNKNOWN","paymentVisa":"UNKNOWN","positionMethod":"OSM_NODE","prefectureCode":"JP-05","serviceType":"UNKNOWN","source":"osm","sourceUpdatedAt":"2023-11-12T04:09:05Z"},{"fuelDiesel":"UNKNOWN","fuelHighOctane":"UNKNOWN","fuelRegular":"UNKNOWN","id":"osm:node:11343313269","lat":39.2942293,"lon":140.4281531,"name":"ENEOS","normalizedBrand":"ENEOS","originalBrand":"ENEOS","osmId":11343313269,"osmType":"node","paymentMastercard":"UNKNOWN","paymentVisa":"UNKNOWN","positionMethod":"OSM_NODE","prefectureCode":"JP-05","serviceType":"UNKNOWN","source":"osm","sourceUpdatedAt":"2023-11-12T12:29:32Z"},{"fuelDiesel":"UNKNOWN","fuelHighOctane":"UNKNOWN","fuelRegular":"UNKNOWN","id":"osm:node:11361037811","lat":39.2873124,"lon":140.4233713,"name":"細川商店","osmId":11361037811,"osmType":"node","paymentMastercard":"UNKNOWN","paymentVisa":"UNKNOWN","positionMethod":"OSM_NODE","prefectureCode":"JP-05","serviceType":"UNKNOWN","source":"osm","sourceUpdatedAt":"2023-11-19T00:51:21Z"},{"fuelDiesel":"UNKNOWN","fuelHighOctane":"UNKNOWN","fuelRegular":"UNKNOWN","id":"osm:node:11387831040","lat":39.2085683,"lon":140.5356453,"name":"コスモ","originalBrand":"コスモ","osmId":11387831040,"osmType":"node","paymentMastercard":"UNKNOWN","paymentVisa":"UNKNOWN","positionMethod":"OSM_NODE","prefectureCode":"JP-05","serviceType":"UNKNOWN","source":"osm","sourceUpdatedAt":"2023-12-01T14:18:00Z"},{"fuelDiesel":"UNKNOWN","fuelHighOctane":"UNKNOWN","fuelRegular":"UNKNOWN","id":"osm:node:11391669831","lat":39.344492,"lon":140.4344439,"name":"ENEOS","normalizedBrand":"ENEOS","originalBrand":"ENEOS","osmId":11391669831,"osmType":"node","paymentMastercard":"UNKNOWN","paymentVisa":"UNKNOWN","positionMethod":"OSM_NODE","prefectureCode":"JP-05","serviceType":"UNKNOWN","source":"osm","sourceUpdatedAt":"2023-12-03T11:15:36Z"},{"fuelDiesel":"UNKNOWN","fuelHighOctane":"UNKNOWN","fuelRegular":"UNKNOWN","id":"osm:node:11391821630","lat":39.3450735,"lon":140.4307163,"name":"apollostation","normalizedBrand":"apollostation","originalBrand":"apollostation","osmId":11391821630,"osmType":"node","paymentMastercard":"UNKNOWN","paymentVisa":"UNKNOWN","positionMethod":"OSM_NODE","prefectureCode":"JP-05","serviceType":"UNKNOWN","source":"osm","sourceUpdatedAt":"2023-12-03T12:54:59Z"},{"fuelDiesel":"UNKNOWN","fuelHighOctane":"UNKNOWN","fuelRegular":"UNKNOWN","id":"osm:node:11499559159","lat":39.2053226,"lon":140.5070019,"name":"ENEOS","normalizedBrand":"ENEOS","originalBrand":"ENEOS","osmId":11499559159,"osmType":"node","paymentMastercard":"UNKNOWN","paymentVisa":"UNKNOWN","positionMethod":"OSM_NODE","prefectureCode":"JP-05","serviceType":"UNKNOWN","source":"osm","sourceUpdatedAt":"2024-01-08T08:39:27Z"},{"fuelDiesel":"UNKNOWN","fuelHighOctane":"UNKNOWN","fuelRegular":"UNKNOWN","id":"osm:node:11648583397","lat":39.3554928,"lon":140.4441763,"name":"apollostation","normalizedBrand":"apollostation","originalBrand":"apollostation","osmId":11648583397,"osmType":"node","paymentMastercard":"UNKNOWN","paymentVisa":"UNKNOWN","positionMethod":"OSM_NODE","prefectureCode":"JP-05","serviceType":"UNKNOWN","source":"osm","sourceUpdatedAt":"2024-02-21T07:44:16Z"},{"fuelDiesel":"UNKNOWN","fuelHighOctane":"UNKNOWN","fuelRegular":"UNKNOWN","id":"osm:node:11664734967","lat":39.3412601,"lon":140.4004064,"name":"JA-SS","originalBrand":"JA","osmId":11664734967,"osmType":"node","paymentMastercard":"UNKNOWN","paymentVisa":"UNKNOWN","positionMethod":"OSM_NODE","prefectureCode":"JP-05","serviceType":"UNKNOWN","source":"osm","sourceUpdatedAt":"2024-02-26T08:50:53Z"},{"fuelDiesel":"UNKNOWN","fuelHighOctane":"UNKNOWN","fuelRegular":"UNKNOWN","id":"osm:node:11917091085","lat":39.3652207,"lon":140.5181845,"name":"apollostation","normalizedBrand":"apollostation","originalBrand":"apollostation","osmId":11917091085,"osmType":"node","paymentMastercard":"UNKNOWN","paymentVisa":"UNKNOWN","positionMethod":"OSM_NODE","prefectureCode":"JP-05","serviceType":"UNKNOWN","source":"osm","sourceUpdatedAt":"2024-05-19T02:18:53Z"},{"fuelDiesel":"UNKNOWN","fuelHighOctane":"UNKNOWN","fuelRegular":"UNKNOWN","id":"osm:node:11949986959","lat":39.407565,"lon":140.4811749,"name":"ENEOS","normalizedBrand":"ENEOS","originalBrand":"ENEOS","osmId":11949986959,"osmType":"node","paymentMastercard":"UNKNOWN","paymentVisa":"UNKNOWN","positionMethod":"OSM_NODE","prefectureCode":"JP-05","serviceType":"UNKNOWN","source":"osm","sourceUpdatedAt":"2024-06-01T12:53:40Z"},{"fuelDiesel":"UNKNOWN","fuelHighOctane":"UNKNOWN","fuelRegular":"UNKNOWN","id":"osm:node:12063304346","lat":39.4505086,"lon":140.5011123,"name":"apollostation","normalizedBrand":"apollostation","originalBrand":"apollostation","osmId":12063304346,"osmType":"node","paymentMastercard":"UNKNOWN","paymentVisa":"UNKNOWN","positionMethod":"OSM_NODE","prefectureCode":"JP-05","serviceType":"UNKNOWN","source":"osm","sourceUpdatedAt":"2024-07-19T14:23:22Z"},{"fuelDiesel":"UNKNOWN","fuelHighOctane":"UNKNOWN","fuelRegular":"UNKNOWN","id":"osm:node:12064706244","lat":39.4471257,"lon":140.4797153,"name":"ENEOS","normalizedBrand":"ENEOS","originalBrand":"ENEOS","osmId":12064706244,"osmType":"node","paymentMastercard":"UNKNOWN","paymentVisa":"UNKNOWN","positionMethod":"OSM_NODE","prefectureCode":"JP-05","serviceType":"UNKNOWN","source":"osm","sourceUpdatedAt":"2024-07-20T12:56:06Z"},{"fuelDiesel":"UNKNOWN","fuelHighOctane":"UNKNOWN","fuelRegular":"UNKNOWN","id":"osm:node:12064706275","lat":39.4466576,"lon":140.4807568,"name":"ENEOS","normalizedBrand":"ENEOS","originalBrand":"ENEOS","osmId":12064706275,"osmType":"node","paymentMastercard":"UNKNOWN","paymentVisa":"UNKNOWN","positionMethod":"OSM_NODE","prefectureCode":"JP-05","serviceType":"UNKNOWN","source":"osm","sourceUpdatedAt":"2024-07-20T12:56:06Z"},{"fuelDiesel":"UNKNOWN","fuelHighOctane":"UNKNOWN","fuelRegular":"UNKNOWN","id":"osm:node:12065714219","lat":39.4448881,"lon":140.4812364,"name":"ENEOS","normalizedBrand":"ENEOS","originalBrand":"ENEOS","osmId":12065714219,"osmType":"node","paymentMastercard":"UNKNOWN","paymentVisa":"UNKNOWN","positionMethod":"OSM_NODE","prefectureCode":"JP-05","serviceType":"UNKNOWN","source":"osm","sourceUpdatedAt":"2024-07-21T05:00:56Z"},{"fuelDiesel":"UNKNOWN","fuelHighOctane":"UNKNOWN","fuelRegular":"UNKNOWN","id":"osm:node:12076665882","lat":39.4572027,"lon":140.4967978,"name":"ENEOS","normali